{
	"RequestId": 654567898765434,
	"Operation": "Create",
	"Type": "Journal",
	"Data": {
		"BatchName": "Test Batch from API",
		"BatchDescription": "Test Batch from API",
		"LedgerId": "300000002335898",
		"AccountingPeriodName": "Feb-21",
		"AccountingDate": "2021-02-08",
		"UserSourceName": "SIS GL Interface",
		"UserCategoryName": "SIS GL Interface",
		"ErrorToSuspenseFlag": "false",
		"SummaryFlag": "false",
		"ImportDescriptiveFlexField": "Y",
		"GlInterface": [
			{
				"Reference4": "Test Journal from API",
				"Reference5": "Test Journal from API",
				"LedgerId": "300000002335898",
				"PeriodName": "Feb-21",
				"AccountingDate": "2021-02-08",
				"UserJeSourceName": "SIS GL Interface",
				"UserJeCategoryName": "SIS GL Interface",
				"Segment1": "101",
				"Segment2": "999",
				"Segment3": "1111101",
				"Segment4": "999",
				"Segment5": "999",
				"Segment6": "9999",
				"Segment7": "99999",
				"Segment8": "99999",
				"Segment9": "999",
				"Segment10": "999",
				"Segment11": "9999",
				"CurrencyCode": "INR",
				"EnteredDrAmount": {
					"@currencyCode": "INR",
					"#text": "2000"
				},
				"AccountedDr": "2000",
				"Reference1": "Test Journal from API",
				"Reference2": "Test Journal from API",
				"Attribute1": "Test Attribute1",
				"Attribute2": "Test Attribute2",
				"Attribute3": "Test Attribute3",
				"Attribute4": "Test Attribute4",
				"SetOfBooksId": "300000002335898",
				"TransactionDate": "2021-02-09",
				"GroupId": "123"
			},
			{
				"Reference4": "Test Journal from API",
				"Reference5": "Test Journal from API",
				"LedgerId": "300000002335898",
				"PeriodName": "Feb-21",
				"AccountingDate": "2021-02-08",
				"UserJeSourceName": "SIS GL Interface",
				"UserJeCategoryName": "SIS GL Interface",
				"Segment1": "101",
				"Segment2": "999",
				"Segment3": "1111102",
				"Segment4": "999",
				"Segment5": "999",
				"Segment6": "9999",
				"Segment7": "99999",
				"Segment8": "99999",
				"Segment9": "999",
				"Segment10": "999",
				"Segment11": "9999",
				"CurrencyCode": "INR",
				"EnteredCrAmount": {
					"@currencyCode": "INR",
					"#text": "1000"
				},
				"AccountedCr": "1000",
				"Reference1": "Test Journal from API",
				"Reference2": "Test Journal from API",
				"Attribute1": "Test Attribute1",
				"Attribute2": "Test Attribute2",
				"Attribute3": "Test Attribute3",
				"Attribute4": "Test Attribute4",
				"SetOfBooksId": "300000002335898",
				"TransactionDate": "2021-02-09",
				"GroupId": "123"
			},
			{
				"Reference4": "Test Journal from API",
				"Reference5": "Test Journal from API",
				"LedgerId": "300000002335898",
				"PeriodName": "Feb-21",
				"AccountingDate": "2021-02-08",
				"UserJeSourceName": "SIS GL Interface",
				"UserJeCategoryName": "SIS GL Interface",
				"Segment1": "101",
				"Segment2": "999",
				"Segment3": "1111105",
				"Segment4": "999",
				"Segment5": "999",
				"Segment6": "9999",
				"Segment7": "99999",
				"Segment8": "99999",
				"Segment9": "999",
				"Segment10": "999",
				"Segment11": "9999",
				"CurrencyCode": "INR",
				"EnteredCrAmount": {
					"@currencyCode": "INR",
					"#text": "1000"
				},
				"AccountedCr": "1000",
				"Reference1": "Test Journal from API",
				"Reference2": "Test Journal from API",
				"Attribute1": "Test Attribute1",
				"Attribute2": "Test Attribute2",
				"Attribute3": "Test Attribute3",
				"Attribute4": "Test Attribute4",
				"SetOfBooksId": "300000002335898",
				"TransactionDate": "2021-02-09",
				"GroupId": "123"
			}
		]
	}
}