{
	"RequestId": 654567898765434,
	"Operation": "Create",
	"Type": "MSSContact",
	"Data": {
		"CreatedByModule": "SIS",
		"PersonProfile": {
			"PersonFirstName": "MgFN_02",
			"PersonLastName": "MgLN_02",
			"CreatedByModule": "SIS"
		},
		"Relationship": {
			"SubjectType": "PERSON",
			"SubjectTableName": "HZ_PARTIES",
			"ObjectId": "300000003009608",
			"ObjectType": "ORGANIZATION",
			"ObjectTableName": "HZ_PARTIES",
			"RelationshipCode": "CONTACT_OF",
			"RelationshipType": "CONTACT",
			"StartDate": "2020-09-24",
			"CreatedByModule": "SIS",
			"OrganizationContact": {
				"ContactNumber": "MgContact02",
				"CreatedByModule": "SIS",
				"OrganizationContactRole": {
					"RoleType": "CONTACT",
					"PrimaryFlag": true,
					"CreatedByModule": "SIS"
				}
			},
			"Email": {
				"OwnerTableName": "HZ_PARTIES",
				"PrimaryFlag": true,
				"CreatedByModule": "SIS",
				"ContactPointPurpose": "BUSINESS",
				"StartDate": "2020-09-24",
				"EmailAddress": "test2@test.com"
			},
			"Phone": {
				"OwnerTableName": "HZ_PARTIES",
				"PrimaryFlag": true,
				"CreatedByModule": "SIS",
				"StartDate": "2020-09-24",
				"PhoneCountryCode": "test2@test.com",
				"PhoneNumber": "test2@test.com"
			}
		}
	}
}