{
	"RequestId": 654567898765434,
 	"Operation": "Create",
	"Type": "ApplyOnAccountCreditMemo",
	"Data": {
		"applyOnAccountCreditMemo": {
			"BusinessUnit": "SXP Group BU",
			"CreditMemoTrxNumber": "204763",
			"InvoiceTrxNumber": "204763",
			"AmountApplied": 5.5,
			"ApplyDate": "2021-03-31",
			"GlDate": "2021-03-31",
			"InvoiceLineNumber": "1",
			"Comments": ""
		}
	}
}