{
  "RequestId": 125792021021217,
  "Operation":"Create",
   "Type":"Credit",
   "Data":{
      "Lines": [
         {
            "OrgId": "300000001869043",
            "BillCustomerAccountNumber": "1",
            "BillCustomerSiteNumber": "2014",
            "BatchSourceName": "SIS_AR_IMPORT",
            "CurrencyCode": "INR",
            "CustomerTrxTypeName": "Credit Memo",
            "Description": "Test Debit Memo",
            "LineType": "LINE",
            "Quantity": "1",
            "TrxNumber": "0710202003CM",
            "TrxDate": "2020-10-07",
            "GlDate": "2020-10-07",
            "UnitSellingPrice": "-225",
            "AmountIncludesTax": "N",
            "TaxJurisdictionCode": "AU GST",
			"Tax": "AU GST",
			"TaxRateCode": "AU GST 10%",
			"TaxRegimeCode": "AU GST REGIME",
			"Taxable": "Y",
			"ReasonCodeMeaning": "Billing",
			"Comments": "Test Comments",
			"LegalEntityId": "300000001608257",
			"ProductFiscClassification": "12.00-30049099",
            "TransactionInterfaceLineDff": {
               "Type": "Otherinvoicedetails",
               "Content": "OtherInvoiceDetails",
               "ContentDisplayValue": "OtherInvoiceDetails",
               "OtherDetails": "0710202003CM-1"
            }
         },
         {
            "OrgId": "300000001869043",
            "BillCustomerAccountNumber": "1",
            "BillCustomerSiteNumber": "2014",
            "BatchSourceName": "SIS_AR_IMPORT",
            "CurrencyCode": "INR",
            "CustomerTrxTypeName": "Credit Memo",
            "Description": "Test Debit Memo",
            "LineType": "LINE",
            "Quantity": "1",
            "TrxNumber": "0710202003CM",
            "TrxDate": "2020-10-07",
            "GlDate": "2020-10-07",
            "UnitSellingPrice": "-225",
            "AmountIncludesTax": "N",
			 "TaxJurisdictionCode": "AU GST",
			"Tax": "AU GST",
			"TaxRateCode": "AU GST 10%",
			"TaxRegimeCode": "AU GST REGIME",
			"Taxable": "Y",
			"ReasonCodeMeaning": "Billing",
			"Comments": "Test Comments",
			"LegalEntityId": "300000001608257",
            "ProductFiscClassification": "12.00-30049099",
            "TransactionInterfaceLineDff": {
               "Type": "Otherinvoicedetails",
               "Content": "OtherInvoiceDetails",
               "ContentDisplayValue": "OtherInvoiceDetails",
               "OtherDetails": "0710202003CM-1"
            }
         }
      ],
      "processControl": {
         "partialFailureAllowed": "false"
      }
   }
}