{
	"RequestId": 1234567890,
	"Operation": "Create",
	"Type": "UploadAttachment",
	"Data": {
		"entityName": "RA_CUSTOMER_TRX_ALL",
		"categoryName": "CUSTOMER_TRX",
		"allowDuplicate": "Yes",
		"attachmentRows": {
			"UserKeyA": "SXP Group BU",
			"UserKeyB": "CN12345",
			"UserKeyC": "SIS_AR_IMPORT",
			"UserKeyD": "NetSuite will pass null.  Grab value from the CustomerTransactionId generated from the GET_AR_CreditResponse",
			"AttachmentType": "FILE",
			"Title": "TESTAV.txt",
			"Content": "BASE64_Content"
		}
	}
}