{
	"RequestId": 654567898765434,
	"Operation": "Create",
	"Type": "Dispute",
	"Data": {
		"operationMode": "SINGLE",
		"object": {
			"EntityName": "Receivables Invoice",
			"ContextValue": "Dispute Management",
			"UserKeyA": "12000",
			"DFFAttributes": {
				"ATTRIBUTE3": "N",
				"ATTRIBUTE8": "2020-12-01",
				"ATTRIBUTE9": "Y",
				"ATTRIBUTE10": "Test Distribute Reason",
				"ATTRIBUTE11": "2020-12-31"
			}
		}
	}
}