{
	"RequestId": 123456789,
	"Operation": "Create",
	"Type": "CreditDistribution",
	"Data": {
		"applyOnAccountCreditMemo": {
			"BusinessUnit": "Dusters Total Solutions Services Pvt. Ltd.",
			"CreditMemoTrxNumber": "17910202003CM",
			"InvoiceTrxNumber": "22003",
			"AmountApplied": "100",
			"ApplyDate": "2020-10-22",
			"GlDate": "2020-10-22",
			"InvoiceLineNumber": "1",
			"Comments": "SOAP API APPLY"
		}
	}
}